{
  "$schema": "./source-of-truth.schema.json",
  "schemaVersion": "1.0.0",
  "releaseTrainId": "oc-2026.7.1-2-locked.1",
  "sources": [
    {
      "id": "SOT-01",
      "name": "OpenClaw qua Gateway RPC và contract chính thức",
      "owner": "openclaw",
      "role": "authoritative",
      "authoritativeDomains": ["sessions", "transcripts", "agent-runtime", "model-status", "usage", "openclaw-audit", "schedule-runtime", "channel-runtime", "plugin-runtime", "node-runtime"],
      "writers": ["OpenClaw Gateway and official CLI/config/backup contracts"],
      "readers": ["AI for Boss Adapter", "AI for Boss Supervisor"],
      "rules": ["AI for Boss may keep rebuildable projections only", "Never read or mutate OpenClaw SQLite, transcript, cache or private state directly"],
      "failureBehavior": "Keep the last confirmed projection read-only and reconcile through official RPC/CLI after recovery."
    },
    {
      "id": "SOT-02",
      "name": "Kho dữ liệu sản phẩm AI for Boss có version",
      "owner": "ai-for-boss",
      "role": "authoritative",
      "authoritativeDomains": ["product-policy", "advisor-rubric", "product-approval-metadata", "product-audit-metadata", "ui-preferences", "cohort-pack", "role-pack", "personal-overlay", "budget-policy", "project-folder-grant"],
      "writers": ["AI for Boss Supervisor through versioned transactions"],
      "readers": ["AI for Boss Main", "Policy Compiler", "Advisor Orchestrator", "Backup subsystem"],
      "rules": ["Renderer never writes storage directly", "Migrations require snapshot and rollback", "Do not duplicate OpenClaw authoritative runtime data"],
      "failureBehavior": "Transaction fails atomically, old version remains authoritative and new work requiring the write stops."
    },
    {
      "id": "SOT-03",
      "name": "Kho bí mật của hệ điều hành cho static secret",
      "owner": "operating-system",
      "role": "credential-authority",
      "authoritativeDomains": ["static-provider-secret", "static-connector-secret"],
      "writers": ["Credential Broker after user approval"],
      "readers": ["Credential Broker for the exact runtime target"],
      "rules": ["Only after three-OS SecretRef contract tests", "Never expose value to renderer, argv, logs, crash report or support bundle", "No plaintext fallback"],
      "failureBehavior": "Connector remains disabled and the user receives a recoverable storage error."
    },
    {
      "id": "SOT-04",
      "name": "OpenClaw native auth store trong profile riêng",
      "owner": "openclaw",
      "role": "credential-authority",
      "authoritativeDomains": ["oauth-token", "provider-auth-profile", "channel-credential", "device-token"],
      "writers": ["OpenClaw official auth, channel and pairing flows"],
      "readers": ["OpenClaw runtime only; AI for Boss reads status through official contract"],
      "rules": ["Separate profile per Agent or trust boundary", "ACL restricted to the OS user", "Avoid cloud-synced directories", "Never copy token into product DB"],
      "failureBehavior": "Connection is unavailable; revoke or restart auth through OpenClaw without reading the token."
    },
    {
      "id": "SOT-05",
      "name": "Agent Home riêng của từng Agent",
      "owner": "openclaw",
      "role": "authoritative",
      "authoritativeDomains": ["agent-identity-files", "agent-persona", "agent-user-profile", "agent-memory", "agent-heartbeat", "bootstrap-state"],
      "writers": ["OpenClaw Agent and AI for Boss Genesis transaction through documented workspace contract"],
      "readers": ["The matching Agent", "AI for Boss Supervisor for validation and recovery"],
      "rules": ["One Agent Home per Agent", "No secret in Markdown", "BOOTSTRAP.md removed only after verified activation", "Do not create memory before bootstrap completes"],
      "failureBehavior": "Keep BOOTSTRAP.md and staging data, mark PENDING_RESUME and preserve the previous active identity."
    },
    {
      "id": "SOT-06",
      "name": "Không gian dự án do người dùng chọn",
      "owner": "user",
      "role": "authoritative",
      "authoritativeDomains": ["business-source-file", "user-owned-artifact"],
      "writers": ["User", "Agent with explicit read-write grant through sandbox contract"],
      "readers": ["User", "Agent with explicit read-only or read-write grant"],
      "rules": ["Separate from Agent Home", "Grant is none, read-only or read-write", "Canonical path must remain inside allowlist", "No symlink or hardlink boundary bypass"],
      "failureBehavior": "Mark project unavailable and deny access; never select or create an alternate folder silently."
    },
    {
      "id": "SOT-07",
      "name": "Release train và manifest đã ký",
      "owner": "release-pipeline",
      "role": "immutable-contract",
      "authoritativeDomains": ["runtime-version", "gateway-contract", "capability-contract", "release-artifact", "release-signature", "platform-support-matrix"],
      "writers": ["Clean release pipeline with accountable release owner"],
      "readers": ["Installer", "Updater", "Supervisor", "Diagnostics", "Website download recommender"],
      "rules": ["Exact version, hash and signature", "No dynamic tags", "No private workspace package import", "Promotion requires platform evidence"],
      "failureBehavior": "Reject install/update and retain the previous verified release."
    },
    {
      "id": "SOT-08",
      "name": "Artifact phục hồi được mã hóa",
      "owner": "user",
      "role": "recovery-artifact",
      "authoritativeDomains": ["encrypted-recovery-snapshot"],
      "writers": ["AI for Boss backup subsystem using official OpenClaw backup plus product snapshot"],
      "readers": ["AI for Boss restore staging after user authorization"],
      "rules": ["Never a live writable source", "Portable full backup always encrypted", "Verify before restore", "New device, Gateway and remote identities after restore"],
      "failureBehavior": "Reject the archive, keep current data unchanged and report verification failure."
    },
    {
      "id": "SOT-09",
      "name": "Control plane tương lai",
      "owner": "future-control-plane",
      "role": "future-authority",
      "authoritativeDomains": ["license", "enrollment", "signed-enterprise-policy", "rollout-assignment", "approved-health-metadata"],
      "writers": ["Future enterprise administrators and release operations"],
      "readers": ["Future enrolled AI for Boss instances"],
      "rules": ["No prompt, file, output or customer secret by default", "Provider and data model require Product Owner decision before Gate 7"],
      "failureBehavior": "Keep last valid signed policy within its expiry; deny new privileged enrollment or policy expansion."
    }
  ],
  "flows": [
    {
      "id": "DF-01",
      "name": "Cài đặt và khởi động AI Engine",
      "trigger": "Người dùng chạy artifact đúng OS/architecture",
      "steps": [
        { "from": "USER", "to": "INSTALLER", "data": ["install-choice"], "trustBoundary": "TB-01", "control": "Show publisher, version, requested privilege and data-retention behavior" },
        { "from": "INSTALLER", "to": "SOT-07", "data": ["release-manifest", "hash", "signature"], "trustBoundary": "TB-03", "control": "Fail closed on mismatch or unsupported platform" },
        { "from": "SUPERVISOR", "to": "GATEWAY", "data": ["loopback-endpoint", "ephemeral-bootstrap-auth"], "trustBoundary": "TB-02", "control": "Supervisor-only ownership; renderer receives status only" }
      ],
      "untrustedInputs": ["downloaded artifact", "host environment", "pre-existing processes"],
      "secrets": ["Gateway bootstrap credential"],
      "approvals": ["OS elevation only when a documented install operation requires it"],
      "failureBehavior": "Abort or rollback installation; do not kill foreign processes or reuse another Gateway.",
      "threatRefs": ["T-01", "T-02", "T-08"]
    },
    {
      "id": "DF-02",
      "name": "Kết nối provider",
      "trigger": "Người dùng chọn một auth mode được auth-support manifest cho phép",
      "steps": [
        { "from": "RENDERER", "to": "MAIN", "data": ["provider-id", "auth-mode", "user-intent"], "trustBoundary": "TB-01", "control": "Schema and sender validation; no secret accepted by generic renderer IPC" },
        { "from": "SUPERVISOR", "to": "SOT-03", "data": ["static-secret-reference"], "trustBoundary": "TB-02", "control": "Credential Broker exact-target access; unavailable until contract gate" },
        { "from": "GATEWAY", "to": "SOT-04", "data": ["oauth-state", "oauth-token", "auth-profile"], "trustBoundary": "TB-03", "control": "PKCE/state, fresh callback session and OpenClaw-owned commit" },
        { "from": "GATEWAY", "to": "PROVIDER", "data": ["live-probe", "model-request"], "trustBoundary": "TB-03", "control": "Allowlisted provider route and explicit account" }
      ],
      "untrustedInputs": ["browser callback", "provider error", "plugin-owned auth response"],
      "secrets": ["API key", "OAuth token", "device code", "provider cookie if upstream uses one"],
      "approvals": ["Connect", "Disconnect/revoke", "Experimental auth acknowledgement"],
      "failureBehavior": "Delete temporary state, keep connector disconnected and never silently switch auth route or provider.",
      "threatRefs": ["T-03", "T-04", "T-05", "T-12"]
    },
    {
      "id": "DF-03",
      "name": "Phiên làm việc và model call",
      "trigger": "Người dùng giao mục tiêu trong một phiên",
      "steps": [
        { "from": "USER", "to": "RENDERER", "data": ["goal", "attachment", "session-model", "budget"], "trustBoundary": "TB-01", "control": "Permission and data-egress preview" },
        { "from": "MAIN", "to": "GATEWAY", "data": ["validated-session-command", "idempotency-key"], "trustBoundary": "TB-02", "control": "Allowlisted IPC and least-privilege scope" },